{
  "id": "fb1e341e-092f-4479-920a-80157cb29595",
  "title": "n8n",
  "url": "https://github.com/n8n-io/n8n",
  "source": "github-search",
  "collected_at": "2026-05-01T08:11:56+08:00",
  "processed_at": "2026-05-01T08:12:48+08:00",
  "summary": "n8n是一个功能强大的Fair-code工作流自动化平台，兼具可视化编排和代码自定义能力。平台原生支持AI功能，提供400多种集成选项，支持自托管和云端部署。用户可以通过拖拽式界面快速构建自动化流程，同时也能编写自定义代码实现复杂逻辑，是企业级工作流自动化的优秀选择。",
  "highlights": [
    "Fair-code模式，兼顾开源与商业化",
    "400+集成，丰富的生态系统"
  ],
  "relevance_score": 8,
  "tags": [
    "workflow-automation",
    "ai-integration"
  ],
  "category": "工具",
  "maturity": "生产"
}