{
  "id": "2bf416e2-3af8-47eb-bb6f-80b54fec7ce6",
  "title": "langflow",
  "url": "https://github.com/langflow-ai/langflow",
  "source": "github-search",
  "collected_at": "2026-04-24T11:44:48+08:00",
  "processed_at": "2026-04-24T11:46:18+08:00",
  "summary": "Langflow是一个强大的可视化AI工作流构建平台，采用拖拽式界面设计，支持用户通过图形化方式创建、测试和部署AI代理及应用。它基于LangChain构建，提供丰富的预置组件和灵活的扩展能力，可快速原型化复杂的AI工作流程，降低AI应用开发门槛。",
  "highlights": [
    "可视化拖拽界面，降低AI工作流开发门槛",
    "基于LangChain生态，提供丰富的组件库和集成能力"
  ],
  "relevance_score": 8,
  "tags": [
    "agent-framework",
    "visual-tool"
  ],
  "category": "框架",
  "maturity": "生产"
}