{
  "id": "b8221d61-078d-4d73-b8fd-41b4527bb7b0",
  "title": "Uber torches 2026 AI budget on Claude Code in four months",
  "url": "https://www.briefs.co/news/uber-torches-entire-2026-ai-budget-on-claude-code-in-four-months/",
  "source": "rss",
  "collected_at": "2026-05-05T08:13:07+08:00",
  "processed_at": "2026-05-05T08:13:56+08:00",
  "summary": "报道称Uber在四个月内耗尽2026年全部AI预算用于Claude Code，显示企业级AI编程工具的采纳速度超预期。该事件反映出AI代码助手在企业开发流程中的深度渗透，以及对传统软件开发模式的潜在颠覆。",
  "highlights": [
    "企业AI编程工具采纳速度超预期",
    "AI代码助手对传统开发模式的颠覆"
  ],
  "relevance_score": 7,
  "tags": [
    "enterprise-ai",
    "ai-coding"
  ],
  "category": "实践",
  "maturity": "生产"
}