{
  "id": "1884421f-d63e-416c-b624-70b68f12e2a9",
  "title": "openclaw",
  "url": "https://github.com/openclaw/openclaw",
  "source": "github-search",
  "collected_at": "2026-04-25T13:31:48+08:00",
  "processed_at": "2026-04-25T13:33:07+08:00",
  "summary": "一款跨平台个人AI助手，支持任意操作系统与平台。采用独特的“龙虾”理念构建，旨在为用户提供无处不在的智能辅助体验。它强调通用性与个性化定制，致力于成为用户在数字生活中的全能智能管家，能够无缝集成各类工作流，显著提升个人与团队的工作效率，保障数据隐私安全。",
  "highlights": [
    "跨平台全兼容，支持任意OS与平台",
    "独特的“龙虾”理念与个性化定制"
  ],
  "relevance_score": 6,
  "tags": [
    "ai-assistant",
    "cross-platform"
  ],
  "category": "工具",
  "maturity": "实验"
}