{
  "id": "750abc63-9e7f-4d78-90ea-cbbfab2769fd",
  "title": "Kernel code removals driven by LLM-created security reports",
  "url": "https://lwn.net/Articles/1068928/",
  "source": "rss",
  "collected_at": "2026-04-24T13:33:20+08:00",
  "processed_at": "2026-04-24T13:34:19+08:00",
  "summary": "LWN报道了Linux内核维护者开始基于LLM生成的安全报告移除代码的现象。文章讨论了自动化代码审查工具在开源项目中的应用，以及可能带来的误判风险和对开发者工作流程的影响。",
  "highlights": [
    "LLM生成的安全报告驱动内核代码移除",
    "自动化代码审查对开源生态的影响"
  ],
  "relevance_score": 7,
  "tags": [
    "kernel",
    "security-automation"
  ],
  "category": "实践",
  "maturity": "测试"
}