{
  "id": "d8e08ffd-8e52-467b-90b4-1874d59cbd3f",
  "title": "Your CEO is suffering from AI psychosis",
  "url": "https://handyai.substack.com/p/your-ceo-is-suffering-from-ai-psychosis",
  "source": "rss",
  "collected_at": "2026-05-02T08:10:46+08:00",
  "processed_at": "2026-05-02T08:11:38+08:00",
  "summary": "文章探讨企业CEO对AI技术过度乐观的现象，被称为「AI精神病」。作者认为部分高管对AI能力存在不切实际的期望，可能导致决策失误和资源浪费。这一观点引发关于AI实际能力与公众预期之间差距的讨论。",
  "highlights": [
    "揭示CEO对AI能力过度乐观的现象",
    "探讨AI实际能力与公众期望的差距"
  ],
  "relevance_score": 6,
  "tags": [
    "ai-adoption",
    "business-strategy"
  ],
  "category": "实践",
  "maturity": "实验"
}